{
  "schema_version": "1.0.0",
  "status": "specification_not_implementation",
  "controller_owned": [
    "migrations",
    "shared contracts",
    "authorization",
    "global IDs",
    "route registry",
    "dependency locks",
    "release gates"
  ],
  "max_parallel_workers_default": 3,
  "phases": [
    {
      "id": "P00",
      "title": "Baseline and dependency decisions",
      "ticket_ids": [
        "CS-0001",
        "CS-0002",
        "CS-0003"
      ]
    },
    {
      "id": "P01",
      "title": "Contracts, persistence and security",
      "ticket_ids": [
        "CS-0101",
        "CS-0102",
        "CS-0103",
        "CS-0104",
        "CS-0105"
      ]
    },
    {
      "id": "P02",
      "title": "Tasks, materials and UI foundation",
      "ticket_ids": [
        "CS-0201",
        "CS-0202",
        "CS-0203",
        "CS-0204",
        "CS-0205",
        "CS-0206"
      ]
    },
    {
      "id": "P03",
      "title": "Ingestion and evidence",
      "ticket_ids": [
        "CS-0301",
        "CS-0302",
        "CS-0303",
        "CS-0304",
        "CS-0305"
      ]
    },
    {
      "id": "P04",
      "title": "Runs, local AI and core tools",
      "ticket_ids": [
        "CS-0401",
        "CS-0402",
        "CS-0403",
        "CS-0404",
        "CS-0405",
        "CS-0406"
      ]
    },
    {
      "id": "P05",
      "title": "Lab and pilot closeout",
      "ticket_ids": [
        "CS-0501",
        "CS-0502",
        "CS-0503",
        "CS-0504",
        "CS-0505",
        "CS-0506"
      ]
    },
    {
      "id": "P06",
      "title": "Optimization and property learning",
      "ticket_ids": [
        "CS-0601",
        "CS-0602",
        "CS-0603",
        "CS-0604"
      ]
    },
    {
      "id": "P07",
      "title": "Targeted science adapters",
      "ticket_ids": [
        "CS-0701",
        "CS-0702",
        "CS-0703"
      ]
    },
    {
      "id": "P08",
      "title": "Local assistant fine-tuning",
      "ticket_ids": [
        "CS-0801",
        "CS-0802",
        "CS-0803"
      ]
    },
    {
      "id": "P09",
      "title": "Research RL and molecular design",
      "ticket_ids": [
        "CS-0901",
        "CS-0902",
        "CS-0903"
      ]
    },
    {
      "id": "P10",
      "title": "Protected cloud fallback",
      "ticket_ids": [
        "CS-1001",
        "CS-1002",
        "CS-1003",
        "CS-1004"
      ]
    },
    {
      "id": "P11",
      "title": "Release hardening",
      "ticket_ids": [
        "CS-1101",
        "CS-1102",
        "CS-1103",
        "CS-1104"
      ]
    }
  ],
  "tickets": [
    {
      "id": "CS-0001",
      "phase": "P00",
      "title": "Inspect baseline and map current repository",
      "status": "not_started",
      "depends_on": [],
      "owner_role": "controller",
      "write_scope": [
        "docs/execution/",
        "analysis.md",
        "plan.md",
        "tech-specs.md",
        "tasks.md"
      ],
      "handoff_sections": [
        "1",
        "3"
      ],
      "implementation_steps": [
        "Read repository instructions, branch/HEAD/worktree and existing architecture before editing.",
        "Record existing/preserve/modify/new/blocked/deferred components and current test results.",
        "Map proposed paths to actual paths; preserve unrelated work and newer fixes."
      ],
      "acceptance_test_ids": [
        "AT-0001-1",
        "AT-0001-2",
        "AT-0001-3"
      ],
      "external_blocker_ids": [],
      "optional_integration": false,
      "required_evidence": [
        "Actual changed file paths and migration notes",
        "Exact commands and exit status",
        "Acceptance-test outputs linked to stable IDs",
        "Known limitations and live/fixture/blocked capability status"
      ],
      "prohibited_shortcuts": [
        "Do not weaken shared policy/contracts to make tests pass.",
        "Do not claim mocked or skipped execution as a live integration."
      ],
      "evidence": [],
      "requirement_ids": [
        "REQ-0001"
      ]
    },
    {
      "id": "CS-0002",
      "phase": "P00",
      "title": "Pin compatible dependencies and profiles",
      "status": "not_started",
      "depends_on": [
        "CS-0001"
      ],
      "owner_role": "controller",
      "write_scope": [
        "pyproject.toml",
        "uv.lock",
        "package.json",
        "pnpm-lock.yaml",
        "infra/local/",
        "docs/dependencies.lock.md"
      ],
      "handoff_sections": [
        "4",
        "16",
        "26"
      ],
      "implementation_steps": [
        "Check official version-specific APIs, OS support, licenses and model/data rights.",
        "Create isolated core, local_ai, optimization, quantum and training profiles.",
        "Document install checks and avoid importing scientific GPU dependencies in core startup."
      ],
      "acceptance_test_ids": [
        "AT-0002-1",
        "AT-0002-2",
        "AT-0002-3"
      ],
      "external_blocker_ids": [],
      "optional_integration": false,
      "required_evidence": [
        "Actual changed file paths and migration notes",
        "Exact commands and exit status",
        "Acceptance-test outputs linked to stable IDs",
        "Known limitations and live/fixture/blocked capability status"
      ],
      "prohibited_shortcuts": [
        "Do not weaken shared policy/contracts to make tests pass.",
        "Do not claim mocked or skipped execution as a live integration."
      ],
      "evidence": [],
      "requirement_ids": [
        "REQ-0002"
      ]
    },
    {
      "id": "CS-0003",
      "phase": "P00",
      "title": "Create CI, fixtures and command contract",
      "status": "not_started",
      "depends_on": [
        "CS-0002"
      ],
      "owner_role": "controller",
      "write_scope": [
        "infra/ci/",
        ".github/workflows/",
        "fixtures/synthetic/",
        "Makefile"
      ],
      "handoff_sections": [
        "23",
        "25",
        "26"
      ],
      "implementation_steps": [
        "Implement documented commands and separate core, engine and training suites.",
        "Use synthetic labels/measurements only and mark fixture thresholds non-scientific.",
        "Add job timeouts, concurrency cancellation, least-privilege permissions and no private caches."
      ],
      "acceptance_test_ids": [
        "AT-0003-1",
        "AT-0003-2",
        "AT-0003-3"
      ],
      "external_blocker_ids": [],
      "optional_integration": false,
      "required_evidence": [
        "Actual changed file paths and migration notes",
        "Exact commands and exit status",
        "Acceptance-test outputs linked to stable IDs",
        "Known limitations and live/fixture/blocked capability status"
      ],
      "prohibited_shortcuts": [
        "Do not weaken shared policy/contracts to make tests pass.",
        "Do not claim mocked or skipped execution as a live integration."
      ],
      "evidence": [],
      "requirement_ids": [
        "REQ-0003"
      ]
    },
    {
      "id": "CS-0101",
      "phase": "P01",
      "title": "Implement canonical persistence and revision foundation",
      "status": "not_started",
      "depends_on": [
        "CS-0003"
      ],
      "owner_role": "controller",
      "write_scope": [
        "migrations/",
        "services/studio-api/src/studio/persistence/",
        "packages/contracts/"
      ],
      "handoff_sections": [
        "5",
        "6",
        "7"
      ],
      "implementation_steps": [
        "Create scoped IDs, common revision metadata, optimistic locking and reference constraints.",
        "Create migration tests against empty and populated disposable databases.",
        "Store decimal quantities as NUMERIC and immutable accepted payloads with versioned hashes."
      ],
      "acceptance_test_ids": [
        "AT-0101-1",
        "AT-0101-2",
        "AT-0101-3"
      ],
      "external_blocker_ids": [],
      "optional_integration": false,
      "required_evidence": [
        "Actual changed file paths and migration notes",
        "Exact commands and exit status",
        "Acceptance-test outputs linked to stable IDs",
        "Known limitations and live/fixture/blocked capability status"
      ],
      "prohibited_shortcuts": [
        "Do not weaken shared policy/contracts to make tests pass.",
        "Do not claim mocked or skipped execution as a live integration."
      ],
      "evidence": [],
      "requirement_ids": [
        "REQ-0101"
      ]
    },
    {
      "id": "CS-0102",
      "phase": "P01",
      "title": "Enforce principal capabilities and loopback security",
      "status": "not_started",
      "depends_on": [
        "CS-0101"
      ],
      "owner_role": "security",
      "write_scope": [
        "services/studio-api/src/studio/auth/",
        "packages/policy/"
      ],
      "handoff_sections": [
        "21"
      ],
      "implementation_steps": [
        "Implement owner setup, sessions, role capabilities and scoped service contexts.",
        "Enforce same-origin/host protections and artifact/API/event authentication.",
        "Use restricted DB runtime credentials and tests for RLS/service-layer scope."
      ],
      "acceptance_test_ids": [
        "AT-0102-1",
        "AT-0102-2",
        "AT-0102-3"
      ],
      "external_blocker_ids": [],
      "optional_integration": false,
      "required_evidence": [
        "Actual changed file paths and migration notes",
        "Exact commands and exit status",
        "Acceptance-test outputs linked to stable IDs",
        "Known limitations and live/fixture/blocked capability status"
      ],
      "prohibited_shortcuts": [
        "Do not weaken shared policy/contracts to make tests pass.",
        "Do not claim mocked or skipped execution as a live integration."
      ],
      "evidence": [],
      "requirement_ids": [
        "REQ-0102"
      ]
    },
    {
      "id": "CS-0103",
      "phase": "P01",